question,answer
Hi,Hey! Kaise help karu tumhari?
Hello,Hi! Batao kya chahiye?
Hey,Hello! Kya chal raha hai?
Good morning,Good morning! Aaj kya help chahiye?
Good evening,Good evening! Kaise assist karu?
Kaise ho?,Main mast hoon! Tum batao?
Tum kaun ho?,Main ek chatbot hoon jo tumhari help karta hai
Tum kya kar sakte ho?,Main questions ka answer de sakta hoon aur help kar sakta hoon
Mujhe help chahiye,Bilkul! Batao kis cheez mein help chahiye?
Help karo,Sure! Kya problem hai?
Thank you,Welcome! Kabhi bhi pucho 🙂
Thanks bhai,Koi baat nahi bhai 😄
Bye,Bye! Apna dhyaan rakhna!
Milte hain,Theek hai! Phir milte hain 🙂
Baad mein baat karte hain,Theek hai! Main yahin hoon jab chaho tab aa jana
AI kya hai?,AI matlab Artificial Intelligence jo machines ko smart banata hai
Machine learning kya hai?,Machine learning mein system data se seekhta hai
Python kya hai?,Python ek programming language hai jo easy aur powerful hai
Coding kya hoti hai?,Coding matlab computer ko instructions dena
Main bore ho raha hoon,Kuch fun karte hain! Joke sunna hai?
Joke suna,Ek programmer ne job kyu chhodi? Kyunki usse arrays nahi mile 😄
Mujhe sad feel ho raha hai,Main samajh sakta hoon. Baat karna chahoge?
Motivate karo,Tu kar lega! Bas consistency rakho 💪
Thak gaya hoon,"Thoda rest le le bhai, phir fresh feel karega"
Time kya hua hai?,Exact time ke liye apna phone check kar lo 🙂
Aaj kaun sa din hai?,"Phone mein dekh lo, waha exact date milegi"
Tum kaha se ho?,"Main digital hoon, koi physical jagah nahi hai meri"
Kya tum real ho?,"Nahi, main ek virtual assistant hoon"
Kya tum seekh sakte ho?,"Main real-time nahi seekhta, par trained hoon"
Samajh nahi aaya,Mujhe thoda aur explain karo 🙂
Dubara batao,Sure! Main phir se explain karta hoon
Kya matlab?,Chalo main simple words mein samjhata hoon
Tum intelligent ho?,Main try karta hoon sahi answers dene ka 🙂
Tum par trust kar sakte hain?,Main accurate info dene ki puri koshish karta hoon
Kuch batao,Kya tumhe pata hai AI har jagah use ho raha hai?
Internship kya hoti hai?,Internship ek learning experience hota hai company mein
Job kaise milegi?,"Skills build karo, projects banao aur apply karo"
Programming kaise seekhe?,Basics se start karo aur daily practice karo
Data science kya hai?,Data ko analyze karke useful info nikalna hi data science hai
Chatbot kya hota hai?,Chatbot ek program hai jo users se baat karta hai
API kya hai?,API alag-alag software ko connect karta hai.
HTML kya hai?,HTML web pages banane ke liye use hota hai.
CSS kya hai?,CSS web pages ko design karne ke liye use hota hai
JavaScript kya hai?,JavaScript web pages ko interactive banata hai.
Maine project banaya,Wah! Kaisa project hai? Thoda detail mein batao
Project mein help chahiye,Bilkul! Kaha problem aa rahi hai?
Mujhe samajh nahi aa raha,No tension! Step by step samjhenge.
Problem solve kar sakte ho?,Try karte hain! Batao issue kya hai?
Kya kar rahe ho?,"Bas yahin hoon, tumhari help ke liye 🙂"
Chat karoge?,Haan bilkul! Baat karte hain 😊
Hi,Hey! How can I help you today?
Hello,Hi there! What can I do for you?
Hey,Hello! How’s it going?
Good morning,Good morning! How can I assist you?
Good evening,Good evening! What can I help you with?
How are you?,I’m doing great! How about you?
What is your name?,I’m your virtual assistant.
Who are you?,I’m a chatbot here to help you.
What can you do?,I can answer questions and assist you with information.
Can you help me?,Of course! Tell me what you need help with.
I need help,Sure! What do you need help with?
Thank you,You’re welcome!
Thanks a lot,Happy to help!
Bye,Goodbye! Have a great day!
See you,See you soon! Take care.
Talk to you later,Sure! I’ll be here.
What is AI?,AI stands for Artificial Intelligence which enables machines to think and learn.
What is machine learning?,Machine learning allows systems to learn from data.
Explain Python,Python is a simple and powerful programming language.
What is coding?,Coding is writing instructions for computers.
I am bored,Let’s do something fun! Want to hear a joke?
Tell me a joke,Why do programmers prefer dark mode? Because light attracts bugs 😄
I feel sad,I’m here for you. Want to talk about it?
Motivate me,Keep pushing forward—you’re doing better than you think!
I am tired,Take a short break—you deserve it.
What is time?,"I can’t tell exact time, but you can check your device clock."
What is today?,You can check your device for today’s date.
Where are you from?,I exist digitally so I don’t have a physical location.
Are you real?,I’m a virtual assistant not a human.
Can you learn?,"I don’t learn in real-time, but I improve over time."
Do you understand me?,I try my best to understand your questions.
What is your purpose?,I’m here to assist and answer your questions.
Can you chat with me?,Of course! Let’s talk 😊
What are you doing?,Just waiting to help you 🙂
What is internship?,An internship is a short-term learning experience in a company.
How to get a job?,"Build skills create projects, and apply consistently."
How to learn programming?,Start with basics and practice daily.
What is data science?,It is about analyzing data to gain insights.
Explain chatbot,A chatbot is a program that talks with users.
What is API?,API helps different software systems communicate.
What is HTML?,HTML is used to create web pages.
What is CSS?,CSS is used to design web pages.
What is JavaScript?,JavaScript makes websites interactive.
Explain ML project,It sounds interesting! Can you explain your project?
I made a project,That’s awesome! Tell me more about it.
Can you solve my problem?,I’ll try my best! What’s the issue?
I don’t understand,No problem! Can you explain a bit more?
Repeat that,Sure! Let me explain again.
What do you mean?,Let me clarify that for you.
Are you intelligent?,I try to give helpful answers based on my training.
Can I trust you?,I aim to provide accurate and helpful information.
Tell me something,Did you know? AI is used in smartphones and apps daily!
What is the capital of India?,The capital of India is New Delhi.
Who is the Prime Minister of India?,The Prime Minister of India is Narendra Modi.
What is the national animal of India?,The national animal of India is the Bengal Tiger.
What is the national bird of India?,The national bird of India is the Peacock.
What is the national flower of India?,The national flower of India is the Lotus.
Who invented the telephone?,Alexander Graham Bell invented the telephone.
Who discovered gravity?,Isaac Newton discovered gravity.
What is the largest planet in our solar system?,Jupiter is the largest planet in our solar system.
Which planet is known as the Red Planet?,Mars is known as the Red Planet.
What is the smallest planet?,Mercury is the smallest planet in the solar system.
Who is known as the Father of the Nation in India?,Mahatma Gandhi is known as the Father of the Nation in India.
Who wrote the national anthem of India?,Rabindranath Tagore wrote the national anthem of India.
What is the currency of India?,The currency of India is the Indian Rupee.
What is the currency of USA?,The currency of the USA is the US Dollar.
Which is the longest river in the world?,The Nile River is the longest river in the world.
Which is the highest mountain in the world?,Mount Everest is the highest mountain in the world.
Who was the first President of India?,Dr. Rajendra Prasad was the first President of India.
Who was the first Prime Minister of India?,Jawaharlal Nehru was the first Prime Minister of India.
What is the boiling point of water?,The boiling point of water is 100°C.
What is the freezing point of water?,The freezing point of water is 0°C.
What is the largest ocean?,The Pacific Ocean is the largest ocean in the world.
Which gas do plants absorb?,Plants absorb carbon dioxide.
Which gas do humans need to breathe?,Humans need oxygen to breathe.
Who invented the light bulb?,Thomas Edison is credited with inventing the light bulb.
Which country is known as the Land of the Rising Sun?,Japan is known as the Land of the Rising Sun.
Which is the fastest land animal?,The cheetah is the fastest land animal.
Which is the largest mammal?,The blue whale is the largest mammal.
How many continents are there?,There are seven continents.
Which is the smallest continent?,Australia is the smallest continent.
Which is the largest desert?,The Sahara Desert is the largest hot desert.
Who wrote Romeo and Juliet?,William Shakespeare wrote Romeo and Juliet.
Which is the national sport of India?,Hockey is considered the national sport of India.
Who is known as the Missile Man of India?,A.P.J. Abdul Kalam is known as the Missile Man of India.
What is the full form of CPU?,CPU stands for Central Processing Unit.
What is the full form of RAM?,RAM stands for Random Access Memory.
Which organ pumps blood?,The heart pumps blood in the human body.
How many bones are in the human body?,There are 206 bones in the human body.
Which vitamin is obtained from sunlight?,Vitamin D is obtained from sunlight.
What is the speed of light?,The speed of light is approximately 3 x 10^8 m/s.
Who painted the Mona Lisa?,Leonardo da Vinci painted the Mona Lisa.
What is the tallest animal?,The giraffe is the tallest animal.
Which is the largest country by area?,Russia is the largest country by area.
Which country has the largest population?,China has one of the largest populations in the world.
What is the national game of USA?,Baseball is often considered the national game of the USA.
Who discovered penicillin?,Alexander Fleming discovered penicillin.
What is the chemical symbol of water?,The chemical symbol of water is H2O.
Which metal is liquid at room temperature?,Mercury is liquid at room temperature.
Which is the nearest star to Earth?,The Sun is the nearest star to Earth.
What is the hardest natural substance?,Diamond is the hardest natural substance.
